{
  "$schema": "https://json-schema.org/draft/2020-12/schema",
  "$id": "https://custos.the-alephain-guild/gateway-contract/v1/deployment_status.schema.json",
  "title": "DeploymentStatusPayload v1",
  "description": "Runner-reported observed state of a deployment; published to arx.{tenant}.deployment_status.{runner_id}.{spec_id} inside a NatsEnvelope. Sourced from docs/domain.md line 106 (DeploymentStatus BC).",
  "type": "object",
  "required": [
    "status_id",
    "spec_id",
    "container_id",
    "phase",
    "observed_generation",
    "reported_by_runner_id",
    "reported_at"
  ],
  "properties": {
    "status_id": {
      "type": "string",
      "description": "Client-generated status identifier (UUIDv7 recommended)."
    },
    "spec_id": {
      "type": "string",
      "description": "Deployment spec identifier this status references."
    },
    "container_id": {
      "type": "string",
      "description": "Local container / process identifier the runner assigned to the deployment."
    },
    "phase": {
      "type": "string",
      "enum": ["pending", "running", "degraded", "stopped"],
      "description": "Coarse-grained phase (docs/domain.md §DeploymentStatus). `error` is reported via `health.status = \"error\"` while phase stays at the last observable coarse state; a stopped-with-error is `phase = stopped` + `health.reason`."
    },
    "observed_generation": {
      "type": "integer",
      "minimum": 0,
      "description": "Monotonic generation counter from the DeploymentSpec; MUST NOT decrease across successive statuses for the same spec_id."
    },
    "health": {
      "type": "object",
      "description": "Fine-grained health signal — carried separately from phase so a runner can be `phase=running` + `health.status=warning`.",
      "properties": {
        "status": {
          "type": "string",
          "enum": ["healthy", "warning", "error"]
        },
        "reason": {
          "type": "string",
          "description": "Free-form english reason string; safe to expose to the operator UI."
        }
      },
      "required": ["status"],
      "additionalProperties": false
    },
    "started_at": {
      "type": "string",
      "format": "date-time",
      "description": "RFC3339 UTC timestamp of the last successful start; absent while phase == pending."
    },
    "stopped_at": {
      "type": "string",
      "format": "date-time",
      "description": "RFC3339 UTC timestamp of the last transition to phase == stopped; absent while running."
    },
    "last_reconcile_at": {
      "type": "string",
      "format": "date-time",
      "description": "RFC3339 UTC timestamp of the last reconcile-loop iteration that observed this deployment."
    },
    "reported_by_runner_id": {
      "type": "string",
      "description": "Runner identity of the reporter; MUST equal the connected runner_id on arx side (tamper guard)."
    },
    "reported_at": {
      "type": "string",
      "format": "date-time",
      "description": "RFC3339 UTC timestamp when the runner emitted the status."
    }
  },
  "additionalProperties": false
}
