{
  "status_id": "0198a41c-7b1a-7000-8000-000000000001",
  "spec_id": "supertrend-btc-sandbox-001",
  "container_id": "custos-supertrend-sandbox-1",
  "phase": "running",
  "observed_generation": 1,
  "health": {
    "status": "healthy"
  },
  "started_at": "2026-07-11T08:00:00Z",
  "last_reconcile_at": "2026-07-11T08:00:05Z",
  "reported_by_runner_id": "runner-sandbox-1",
  "reported_at": "2026-07-11T08:00:05Z"
}
